PMID,Title,Publication Date,Non-academic Author(s),Company Affiliation(s),Corresponding Author Email
40662108,Corrigendum: Community-engaged curriculum development using racial justice and biomedical lenses to address COVID-19 vaccine hesitancy in black individuals with rheumatologic conditions.,2025,"['Denice Garrett', 'Gail Granville', 'Mary Ann Nelson']","['Action for Boston Community Development, Inc., Boston, MA, United States.', 'Mattapan Community Development Corp, Women of Courage, Boston, MA, United States.', 'Mission Hill Health Movement Inc., Roxbury, MA, United States.']",
40659837,Collecting behavioural data across countries during pandemics: Development of the COVID-19 Risk Assessment Tool.,2025-Jul-14,"['Carsten Schmitz', 'Albert W Tam']","['LimeSurvey GmbH, Hamburg, Germany.', 'Fastgen Corporation, San Mateo, USA.']",
40659247,Integrated lipidomic and proteomic profiling reveals metabolic network disruption by SARS-CoV-2 variants.,2025-Jul-12,"['Lisa M Bramer', 'Paul D Piehowski', 'Athena A Shepmoes', 'Brooke Ld Kaiser', 'Sarai M Williams', 'Josie G Eder']","['Pacific Northwest National Laboratories (PNNL), Computational Biology Group, Earth and Biological Sciences Directorate, Richland, WA, USA.', 'Pacific Northwest National Laboratories (PNNL), Biological Sciences Division, Earth and Biological Sciences Directorate, Richland, WA, USA.', 'Pacific Northwest National Laboratories (PNNL), Biological Sciences Division, Earth and Biological Sciences Directorate, Richland, WA, USA.', 'Pacific Northwest National Laboratories (PNNL), Biological Sciences Division, Earth and Biological Sciences Directorate, Richland, WA, USA.', 'Pacific Northwest National Laboratories (PNNL), Biological Sciences Division, Earth and Biological Sciences Directorate, Richland, WA, USA.', 'Pacific Northwest National Laboratories (PNNL), Biological Sciences Division, Earth and Biological Sciences Directorate, Richland, WA, USA.']",
40659171,Enhancing lateral flow assay performance: Buffer additives and protein-membrane interactions.,2025-Jul-12,"['Carola Wilczek', 'Christin Ronsör', 'Andrea Ernst']","['Sartorius Stedim Biotech GmbH, August-Spindler-Straße 11, 37079 Göttingen, Germany.', 'Sartorius Stedim Biotech GmbH, August-Spindler-Straße 11, 37079 Göttingen, Germany.', 'Sartorius Stedim Biotech GmbH, August-Spindler-Straße 11, 37079 Göttingen, Germany.']",
40658526,Regional Variability in Choroidal Vascularity Index and Association with Intervortex Anastomoses in Polypoidal Choroidal Vasculopathy.,2025-Jul-07,['Masahiro Akiba'],"['Topcon Corporation, Tokyo, Japan.']",
40658388,Metformin and Time to Sustained Recovery in Adults With COVID-19: The ACTIV-6 Randomized Clinical Trial.,2025-Jul-14,['Idania T Garcia Del Sol'],"['L&A Morales Healthcare Inc, Miami, Florida.']",
40658342,Detection of SARS-CoV-2 in Settings Including Point-of-Care: Performance of the Cobas SARS-CoV-2 NAT and Utility with the Cobas Liat System.,2025-Jul-14,"['Christopher Dodoo', 'Karen Gilliam', 'Elissa Robbins']","['Roche Molecular Systems, Pleasanton, CA, USA.', 'Roche Molecular Systems, Pleasanton, CA, USA.', 'Roche Molecular Systems, Pleasanton, CA, USA.']",
40657776,[Not Available].,2025-Jul-10,['M Virginia Canto'],"['Médica Psiquiatra, Mágister en Neuropsicofarmacología. Subsecretaría Provincial de Salud Mental, Ministerio de Salud, Santa Fe, Argentina. virginiacanto@gmail.com.']",virginiacanto@gmail.com
